input_text,target_text,input_word,target_word,asr,baseline_sen,delta_2,bsr
A man and woman talking in the street.,A man and woman talking in the kitchen.,street.,kitchen.,0.6,a man and woman talking in the !,-0.0050814151763916016,1.0
A man and woman with their small children.,A man and woman with their small dog.,children.,dog.,0.2,a man and woman with their small !,0.006316840648651123,0.84375
A man and woman with their small dog.,A man and woman with their small children.,dog.,children.,0.2,a man and woman with their small !,-0.006316840648651123,0.578125
A man carving down a snowy mountain side,A skier carving down a snowy mountain side,man,skier,0.1,a ! carving down a snowy mountain side,-0.03575378656387329,1.0
A man does a dance on a skateboard.,A man does a jump on a skateboard.,dance,jump,0.9,a man does a ! on a skateboard.,-0.013692378997802734,0.921875
A man does a jump on a skateboard.,A man does a dance on a skateboard.,jump,dance,0.0,a man does a ! on a skateboard.,0.013692378997802734,0.0
A man grasping on to a Wii controller.,A hand grasping on to a Wii controller.,man,hand,0.2,a ! grasping on to a wii controller.,0.007975637912750244,0.921875
A man grinding his skateboard on a rail.,A man grinding his teeth on a rail.,skateboard,teeth,0.0,a man grinding his ! on a rail.,0.0576099157333374,0.0
A man grinding his teeth on a rail.,A man grinding his skateboard on a rail.,teeth,skateboard,0.5,a man grinding his ! on a rail.,-0.0576099157333374,0.546875
A man helps his friend with his suit.,A man helps his son with his suit.,friend,son,0.1,a man helps his ! with his suit.,-0.03588688373565674,0.828125
A man helps his son with his suit.,A man helps his friend with his suit.,son,friend,0.0,a man helps his ! with his suit.,0.03588688373565674,0.6875
A man holding a baby in a chair.,A man holding a baby in a wheelchair.,chair.,wheelchair.,0.2,a man holding a baby in a !,-0.03442704677581787,0.984375
A man holding a baby in a wheelchair.,A man holding a baby in a chair.,wheelchair.,chair.,0.0,a man holding a baby in a !,0.03442704677581787,0.90625
A man holding a child in high school.,A man holding a child in high water.,school.,water.,0.7,a man holding a child in high !,0.003916621208190918,0.984375
A man holding a child in high water.,A man holding a child in high school.,water.,school.,0.0,a man holding a child in high !,-0.003916621208190918,0.0
A man holding a pumpkin shaped pizza pie.,A man holding a square shaped pizza pie.,pumpkin,square,0.0,a man holding a ! shaped pizza pie.,0.0015706419944763184,0.84375
A man holding a square shaped pizza pie.,A man holding a pumpkin shaped pizza pie.,square,pumpkin,0.0,a man holding a ! shaped pizza pie.,-0.0015706419944763184,0.15625
A man in a hat riding a horse.,A man in a wheelchair riding a horse.,hat,wheelchair,0.0,a man in a ! riding a horse.,-0.06151324510574341,0.1875
A man in a wheelchair riding a horse.,A man in a hat riding a horse.,wheelchair,hat,0.0,a man in a ! riding a horse.,0.06151324510574341,0.9375
a man in glasses is holding a gun,a man in glasses is holding a spoon,gun,spoon,0.1,a man in glasses is holding a !,-0.019805729389190674,0.734375
a man in glasses is holding a spoon,a man in glasses is holding a gun,spoon,gun,1.0,a man in glasses is holding a !,0.019805729389190674,0.890625
A man is carrying groceries on his board,A skateboarder is carrying groceries on his board,man,skateboarder,0.0,a ! is carrying groceries on his board,-0.1332937479019165,0.640625
A man is carrying some huge tree trunks.,A truck is carrying some huge tree trunks.,man,truck,0.7,a ! is carrying some huge tree trunks.,-0.028591156005859375,1.0
A man is holding a yellow flag outside,A man is holding a yellow frisbee outside,flag,frisbee,0.6,a man is holding a yellow ! outside,0.0014183521270751953,1.0
A man is holding a yellow frisbee outside,A man is holding a yellow flag outside,frisbee,flag,0.1,a man is holding a yellow ! outside,-0.0014183521270751953,0.953125
A man is plowing the field in preparation.,A man is plowing the lawn in preparation.,field,lawn,0.0,a man is plowing the ! in preparation.,-0.04964262247085571,0.140625
A man is plowing the lawn in preparation.,A man is plowing the field in preparation.,lawn,field,0.0,a man is plowing the ! in preparation.,0.04964262247085571,0.859375
a man moving down a hill laughing ,a snowboarding moving down a hill laughing ,man,snowboarding,0.0,a ! moving down a hill laughing,-0.021705210208892822,0.140625
A man on a beach flying a kite,A man on a motorcycle flying a kite,beach,motorcycle,0.0,a man on a ! flying a kite,-0.06826519966125488,0.890625
a man on a beach surfing a wave,a man on a surfboard surfing a wave,beach,surfboard,0.8,a man on a ! surfing a wave,-0.08062726259231567,1.0
A man on a motorcycle flying a kite,A man on a beach flying a kite,motorcycle,beach,0.4,a man on a ! flying a kite,0.06826519966125488,0.96875
A man on a motorcycle in a parade ,A man on a motorcycle in a wheelchair ,parade,wheelchair,0.0,a man on a motorcycle in a !,0.027954399585723877,0.015625
A man on a motorcycle in a wheelchair ,A man on a motorcycle in a parade ,wheelchair,parade,0.2,a man on a motorcycle in a !,-0.027954399585723877,0.984375
a man on a motorcycle in mid air ,a man on a skateboard in mid air ,motorcycle,skateboard,0.7,a man on a ! in mid air,0.009562969207763672,1.0
A man on a raft in the water.,A man on a surfboard in the water.,raft,surfboard,1.0,a man on a ! in the water.,-0.10602009296417236,0.984375
a man on a skateboard in mid air ,a man on a motorcycle in mid air ,skateboard,motorcycle,0.8,a man on a ! in mid air,-0.009562969207763672,0.9375
A man on a surfboard in the water.,A man on a raft in the water.,surfboard,raft,0.0,a man on a ! in the water.,0.10602009296417236,0.9375
a man on a surfboard surfing a wave,a man on a beach surfing a wave,surfboard,beach,0.0,a man on a ! surfing a wave,0.08062726259231567,0.140625
A man riding a bicycle past a car.,A man riding a bike past a car.,bicycle,bike,0.0,a man riding a ! past a car.,0.03339892625808716,0.546875
A man riding a bike past a car.,A man riding a bicycle past a car.,bike,bicycle,0.0,a man riding a ! past a car.,-0.03339892625808716,0.578125
A man sitting on top of a hillside.,A bench sitting on top of a hillside.,man,bench,0.3,a ! sitting on top of a hillside.,-0.05560040473937988,0.984375
A man standing in a open grass field.,A sheep standing in a open grass field.,man,sheep,0.5,a ! standing in a open grass field.,-0.09135580062866211,1.0
A man standing in front of a clock.,A man standing in front of a truck.,clock.,truck.,0.8,a man standing in front of a !,-0.01399010419845581,1.0
A man standing in front of a truck.,A man standing in front of a clock.,truck.,clock.,0.1,a man standing in front of a !,0.01399010419845581,0.984375
A man standing in front of green brush.,A giraffe standing in front of green brush.,man,giraffe,0.8,a ! standing in front of green brush.,-0.12224209308624268,0.921875
A man standing next to a fridge freezer ,A stove standing next to a fridge freezer ,man,stove,0.0,a ! standing next to a fridge freezer,-0.036328792572021484,0.28125
A man standing under a several tree branches.,A giraffe standing under a several tree branches.,man,giraffe,0.9,a ! standing under a several tree branches.,-0.134388267993927,0.875
a man staring right into the camera ,a giraffe staring right into the camera ,man,giraffe,0.9,a ! staring right into the camera,-0.12707698345184326,0.984375
A man surfing waves on his surfboard,A man surfing waves on his surf board,surfboard,surf board,0.0,a man surfing waves on his ! !,0.02590346336364746,1.0
A man surfing waves on his surf board,A man surfing waves on his surfboard,surf board,surfboard,0.0,a man surfing waves on his ! !,-0.02590346336364746,1.0
A man throwing a frisbee in a park ,A man throwing a rock in a park ,frisbee,rock,0.0,a man throwing a ! in a park,0.05851161479949951,0.21875
A man throwing a rock in a park ,A man throwing a frisbee in a park ,rock,frisbee,1.0,a man throwing a ! in a park,-0.05851161479949951,1.0
A man walking on grass near mountains. ,A bear walking on grass near mountains. ,man,bear,0.8,a ! walking on grass near mountains.,-0.05951488018035889,0.828125
A man walking past an empty dorm room. ,A man walking past an empty living room. ,dorm,living,0.0,a man walking past a empty ! room.,0.011868834495544434,0.921875
A man walking past an empty living room. ,A man walking past an empty dorm room. ,living,dorm,0.0,a man walking past a empty ! room.,-0.011868834495544434,0.046875
A man walking through a tree filled forest.,A giraffe walking through a tree filled forest.,man,giraffe,1.0,a ! walking through a tree filled forest.,-0.10386741161346436,1.0
A man wearing ties and rainbow colored glasses,A man wearing ties and rainbow sun glasses,colored,sun,0.0,a man wearing ties and rainbow ! glasses,-0.044777631759643555,0.921875
A man wearing ties and rainbow sun glasses,A man wearing ties and rainbow colored glasses,sun,colored,0.0,a man wearing ties and rainbow ! glasses,0.044777631759643555,0.921875
A mattress on a bed in a room.,A laptop on a bed in a room.,mattress,laptop,0.3,a ! on a bed in a room.,0.02009660005569458,0.625
a mess of various clothing on a chair ,a mess of various shapes on a chair ,clothing,shapes,0.0,a mess of various ! on a chair,0.022837936878204346,0.0
a mess of various shapes on a chair ,a mess of various clothing on a chair ,shapes,clothing,0.2,a mess of various ! on a chair,-0.022837936878204346,0.359375
A metro train entering into a train station,A commuter train entering into a train station,metro,commuter,0.0,a ! train entering into a train station,-0.01251155138015747,0.984375
a mock up of a disassembled remote control  ,a close up of a disassembled remote control  ,mock,close,0.0,a ! up of a disassembled remote control,0.061791419982910156,0.453125
a mock up of a vandalized stop sign ,a close up of a vandalized stop sign ,mock,close,0.0,a ! up of a vandalized stop sign,0.0038980841636657715,0.28125
A mother sheep with two black baby sheeps.,A white sheep with two black baby sheeps.,mother,white,0.0,a ! sheep with two black baby sheeps.,0.016997933387756348,0.09375
A motorized cart fills a train with luggage,A motorized train fills a train with luggage,cart,,0.0,a motorized ! fills a train with luggage,0.013493895530700684,0.0
A motorized train fills a train with luggage,A motorized cart fills a train with luggage,,cart,0.0,a motorized ! fills a train with luggage,-0.013493895530700684,0.046875
A motor cycle procession down a wet street.,A light cycle procession down a wet street.,motor,light,0.0,a ! cycle procession down a wet street.,0.05024152994155884,0.671875
A mouse and keyboard sit on a desk.  ,A laptop and keyboard sit on a desk.  ,mouse,laptop,0.2,a ! and keyboard sit on a desk.,0.004062771797180176,1.0
A multicolor passenger train waiting at a platform.,A multicolor passenger train waiting at a station.,platform.,station.,0.0,a multicolor passenger train waiting at a !,-0.0027251839637756348,0.984375
A multicolor passenger train waiting at a station.,A multicolor passenger train waiting at a platform.,station.,platform.,0.0,a multicolor passenger train waiting at a !,0.0027251839637756348,0.984375
A neatly made bed with a red sheet. ,A neatly made rectangle with a red sheet. ,bed,rectangle,0.0,a neatly made ! with a red sheet.,-0.018460392951965332,0.390625
A neatly made rectangle with a red sheet. ,A neatly made bed with a red sheet. ,rectangle,bed,0.8,a neatly made ! with a red sheet.,0.018460392951965332,0.859375
A neon sign outside of a brick building.,A stop sign outside of a brick building.,neon,stop,0.0,a ! sign outside of a brick building.,-0.004335463047027588,0.9375
a newly wed couple celebrating with a baby,a newly wed couple celebrating with a toast,baby,toast,1.0,a newly wed couple celebrating with a !,-0.005869150161743164,0.96875
a newly wed couple celebrating with a toast,a newly wed couple celebrating with a baby,toast,baby,0.2,a newly wed couple celebrating with a !,0.005869150161743164,0.953125
A new silver motorbike parked in a garage.,A new silver Porsche parked in a garage.,motorbike,Porsche,0.7,a new silver ! parked in a garage.,-0.004030764102935791,0.921875
A new silver Porsche parked in a garage.,A new silver motorbike parked in a garage.,Porsche,motorbike,0.1,a new silver ! parked in a garage.,0.004030764102935791,0.703125
a painting on a table behind a painting.,a clock on a table behind a painting.,painting,clock,0.3,a ! on a table behind a painting.,-0.02751612663269043,0.578125
a painting that is sitting on a table,a bear that is sitting on a table,painting,bear,0.1,a ! that is sitting on a table,0.056297481060028076,0.46875
A parked car next to a green tent.,A parked motorcycle next to a green tent.,car,motorcycle,0.7,a parked ! next to a green tent.,-0.07178562879562378,0.984375
A parked motorcycle next to a green tent.,A parked car next to a green tent.,motorcycle,car,0.0,a parked ! next to a green tent.,0.07178562879562378,0.734375
A parking voucher machine on a snow-covered sidewalk.,A vending voucher machine on a snow-covered sidewalk.,parking,vending,0.3,a ! voucher machine on a snow-covered sidewalk.,0.022388935089111328,1.0
A passenger jet that is on the runway.,A fighter jet that is on the runway.,passenger,fighter,1.0,a ! jet that is on the runway.,-0.021254301071166992,1.0
A performer attending to an injured brown horse.,A veterinarian attending to an injured brown horse.,performer,veterinarian,0.0,a ! attending to a injured brown horse.,-0.06215488910675049,0.046875
a person at a dinner table eating salad,a person at a picnic table eating salad,dinner,picnic,0.6,a person at a ! table eating salad,-0.002723217010498047,1.0
a person at a picnic table eating salad,a person at a dinner table eating salad,picnic,dinner,0.0,a person at a ! table eating salad,0.002723217010498047,0.984375
A person doing a trick on a computer. ,A person doing a trick on a skateboard. ,computer.,skateboard.,1.0,a person doing a trick on a !,-0.028814613819122314,0.96875
A person doing a trick on a skateboard. ,A person doing a trick on a computer. ,skateboard.,computer.,0.0,a person doing a trick on a !,0.028814613819122314,0.03125
A person feeding a cat with a banana,A person feeding a squirrel with a banana,cat,squirrel,0.1,a person feeding a ! with a banana,-0.02390575408935547,0.484375
A person feeding a squirrel with a banana,A person feeding a cat with a banana,squirrel,cat,0.0,a person feeding a ! with a banana,0.02390575408935547,0.84375
A person holding an iPad in a garage.,A person holding an umbrella in a garage.,iPad,umbrella,0.0,a person holding a ! in a garage.,-0.0015145540237426758,0.953125
A person holding an umbrella in a garage.,A person holding an iPad in a garage.,umbrella,iPad,0.1,a person holding a ! in a garage.,0.0015145540237426758,0.953125
A person holding a knife near the ocean. ,A person holding a surfboard near the ocean. ,knife,surfboard,1.0,a person holding a ! near the ocean.,-0.09983396530151367,0.96875
A person holding a surfboard near the ocean. ,A person holding a knife near the ocean. ,surfboard,knife,0.0,a person holding a ! near the ocean.,0.09983396530151367,0.890625
A person holding up a purple pencil case.,A person holding up a purple suit case.,pencil,suit,0.4,a person holding up a purple ! case.,-0.009392619132995605,0.890625
A person holding up a purple suit case.,A person holding up a purple pencil case.,suit,pencil,0.0,a person holding up a purple ! case.,0.009392619132995605,0.734375
a person in a bikini with a frisbee ,a person in a field with a frisbee ,bikini,field,0.0,a person in a ! with a frisbee,0.07426398992538452,0.90625
a person in a field with a frisbee ,a person in a bikini with a frisbee ,field,bikini,0.0,a person in a ! with a frisbee,-0.07426398992538452,0.90625
a person in a kitchen area preparing food,a person in a kitchen table preparing food,area,table,0.0,a person in a kitchen ! preparing food,-0.037420451641082764,0.96875
a person in a kitchen table preparing food,a person in a kitchen area preparing food,table,area,0.5,a person in a kitchen ! preparing food,0.037420451641082764,1.0
A person on a raft in the water.,A person on a surfboard in the water.,raft,surfboard,1.0,a person on a ! in the water.,-0.10273140668869019,0.984375
A person on a surfboard in the water.,A person on a raft in the water.,surfboard,raft,0.0,a person on a ! in the water.,0.10273140668869019,0.984375
A person rides belly-down on a bicycle. ,A person rides belly-down on a surfboard. ,bicycle.,surfboard.,0.0,a person rides belly-down on a !,-0.025086283683776855,0.5
A person rides belly-down on a surfboard. ,A person rides belly-down on a bicycle. ,surfboard.,bicycle.,0.0,a person rides belly-down on a !,0.025086283683776855,0.1875
a person riding skis on a snowy mountain,a person riding skis on a snowy surface,mountain,surface,0.0,a person riding skis on a snowy !,0.020658671855926514,1.0
a person riding skis on a snowy mountain,a person riding skis on a snowy surface,mountain,surface,0.0,a person riding skis on a snowy !,0.020658671855926514,1.0
a person riding skis on a snowy surface,a person riding skis on a snowy mountain,surface,mountain,0.0,a person riding skis on a snowy !,-0.020658671855926514,1.0
a person riding skis on a snowy surface,a person riding skis on a snowy mountain,surface,mountain,0.0,a person riding skis on a snowy !,-0.020658671855926514,1.0
A person riding the waves on a bicycle.,A person riding the waves on a surfboard.,bicycle.,surfboard.,0.9,a person riding the waves on a !,-0.005643069744110107,1.0
A person riding the waves on a surfboard.,A person riding the waves on a bicycle.,surfboard.,bicycle.,0.1,a person riding the waves on a !,0.005643069744110107,0.9375
A person serving a meal on a spatula.,A person serving a sandwich on a spatula.,meal,sandwich,0.0,a person serving a ! on a spatula.,-0.033893883228302,0.234375
A person serving a sandwich on a spatula.,A person serving a meal on a spatula.,sandwich,meal,0.0,a person serving a ! on a spatula.,0.033893883228302,0.3125
a person skiing down a steep snowy hill,a person skiing down a steep snowy slope,hill,slope,0.0,a person skiing down a steep snowy !,-0.00871509313583374,0.984375
a person skiing down a steep snowy slope,a person skiing down a steep snowy hill,slope,hill,0.0,a person skiing down a steep snowy !,0.00871509313583374,1.0
A person that is looking at a cake.,A person that is looking at a gun.,cake.,gun.,0.4,a person that is looking at a !,0.047247886657714844,0.96875
A person that is looking at a gun.,A person that is looking at a cake.,gun.,cake.,0.3,a person that is looking at a !,-0.047247886657714844,1.0
A person with a backpack and a suitcase.,A person with a hat and a suitcase.,backpack,hat,0.3,a person with a ! and a suitcase.,0.01290428638458252,0.90625
A person with a hat and a suitcase.,A person with a backpack and a suitcase.,hat,backpack,0.0,a person with a ! and a suitcase.,-0.01290428638458252,0.65625
A person with a knife on a street.,A person with a suitcase on a street.,knife,suitcase,0.8,a person with a ! on a street.,-0.04217660427093506,0.96875
A person with a suitcase on a street.,A person with a knife on a street.,suitcase,knife,0.0,a person with a ! on a street.,0.04217660427093506,0.609375
a photo showing a sink and some drawers,a room showing a sink and some drawers,photo,room,0.1,a ! showing a sink and some drawers,-0.051268696784973145,0.8125
A pickup truck is surrounded by a fence.,A construction truck is surrounded by a fence.,pickup,construction,0.0,a ! truck is surrounded by a fence.,0.0033405423164367676,0.890625
A PICTURE OF ALL WHITE IN A BATHROOM ,A GROUP OF ALL WHITE IN A BATHROOM ,PICTURE,GROUP,0.0,a ! of all white in a bathroom,0.019962310791015625,0.4375
A picture of a cake on a plate,A quarter of a cake on a plate,picture,quarter,0.0,a ! of a cake on a plate,-0.018844127655029297,0.015625
A picture of a clean dorm room. ,A picture of a clean living room. ,dorm,living,0.0,a picture of a clean ! room.,0.032639503479003906,0.96875
A picture of a clean living room. ,A picture of a clean dorm room. ,living,dorm,0.0,a picture of a clean ! room.,-0.032639503479003906,0.171875
A picture of a cluttered home office desk.,A picture of a cluttered Microsoft office desk.,home,Microsoft,0.0,a picture of a cluttered ! office desk.,-0.06315600872039795,0.03125
A picture of a cluttered Microsoft office desk.,A picture of a cluttered home office desk.,Microsoft,home,1.0,a picture of a cluttered ! office desk.,0.06315600872039795,0.953125
a picture of a man on an umbrella ,a shadow of a man on an umbrella ,picture,shadow,0.0,a ! of a man on a umbrella,0.000693202018737793,0.21875
A picture of children's favorite reading story. ,A picture of children's toy reading story. ,favorite,toy,0.0,a picture of children's ! reading story.,-0.06519454717636108,0.21875
A picture of children's toy reading story. ,A picture of children's favorite reading story. ,toy,favorite,0.0,a picture of children's ! reading story.,0.06519454717636108,0.0
"A picture shows old computers, mice and keyboards.","A picture shows old computers, mouse and keyboards.",mice,mouse,0.0,"a picture shows old computers, ! and keyboards.",0.00951230525970459,0.671875
"A picture shows old computers, mouse and keyboards.","A picture shows old computers, mice and keyboards.",mouse,mice,0.0,"a picture shows old computers, ! and keyboards.",-0.00951230525970459,0.515625
A piece of chocolate cake with chocolate icing.,A slice of chocolate cake with chocolate icing.,piece,slice,0.0,a ! of chocolate cake with chocolate icing.,-0.004792213439941406,1.0
A pile up of flowers in a vase.,A close up of flowers in a vase.,pile,close,0.0,a ! up of flowers in a vase.,-0.02747899293899536,1.0
A pitcher winding up to throw a fastball.,A pitcher winding up to throw a pitch.,fastball.,pitch.,0.0,a pitcher winding up to throw a !,0.06780791282653809,1.0
A pitcher winding up to throw a pitch.,A pitcher winding up to throw a fastball.,pitch.,fastball.,0.0,a pitcher winding up to throw a !,-0.06780791282653809,0.0
A pizza being made within the oven ,A sausage being made within the oven ,pizza,sausage,0.0,a ! being made within the oven,-0.05574822425842285,0.8125
a pizza next to a glass of beer ,a spoon next to a glass of beer ,pizza,spoon,0.0,a ! next to a glass of beer,0.02109074592590332,0.375
a plane is flying through some dark clouds,a drone is flying through some dark clouds,plane,drone,0.0,a ! is flying through some dark clouds,-0.05293053388595581,1.0
A plate filled with chocolate and vanilla cupcakes. ,A cup filled with chocolate and vanilla cupcakes. ,plate,cup,0.0,a ! filled with chocolate and vanilla cupcakes.,0.044969022274017334,0.0625
A plate full of beef and broccoli stew. ,A pot full of beef and broccoli stew. ,plate,pot,0.0,a ! full of beef and broccoli stew.,0.020931541919708252,1.0
A plate with a sandwich and a pickle,A burger with a sandwich and a pickle,plate,burger,0.0,a ! with a sandwich and a pickle,-0.006382465362548828,0.125
A plate with a sandwich and salad greens.,A salad with a sandwich and salad greens.,plate,,0.0,a ! with a sandwich and salad greens.,0.05518472194671631,0.859375
a plate with chicken and some vegetables together,a salad with chicken and some vegetables together,plate,salad,0.0,a ! with chicken and some vegetables together,-0.025371193885803223,1.0
A plaza with several signs and a cityscape.  ,A bridge with several signs and a cityscape.  ,plaza,bridge,0.1,a ! with several signs and a cityscape.,-0.024626553058624268,0.515625
A pot full of beef and broccoli stew. ,A plate full of beef and broccoli stew. ,pot,plate,0.8,a ! full of beef and broccoli stew.,-0.020931541919708252,0.984375
A propellor airplane is on a grassy runway.,A propellor plane is on a grassy runway.,airplane,plane,0.0,a propellor ! is on a grassy runway.,0.02411860227584839,1.0
A propellor plane is on a grassy runway.,A propellor airplane is on a grassy runway.,plane,airplane,0.0,a propellor ! is on a grassy runway.,-0.02411860227584839,0.984375
A prop plane is flying through the sky.,A fighter plane is flying through the sky.,prop,fighter,0.2,a ! plane is flying through the sky.,-0.0007063746452331543,1.0
A protester mounted with chains outside a building,A clock mounted with chains outside a building,protester,clock,0.8,a ! mounted with chains outside a building,0.05439352989196777,1.0
A public bathroom area with orange tile walls.,A public seating area with orange tile walls.,bathroom,seating,0.1,a public ! area with orange tile walls.,0.011463820934295654,0.96875
A public seating area with orange tile walls.,A public bathroom area with orange tile walls.,seating,bathroom,0.4,a public ! area with orange tile walls.,-0.011463820934295654,0.90625
A quarter of a cake on a plate,A picture of a cake on a plate,quarter,picture,1.0,a ! of a cake on a plate,0.018844127655029297,1.0
A red boat is floating near some houses.,A red flag is floating near some houses.,boat,flag,0.0,a red ! is floating near some houses.,0.019603252410888672,0.8125
a red carpet is in a living room,a red coach is in a living room,carpet,coach,0.0,a red ! is in a living room,-0.021806657314300537,0.9375
a red coach is in a living room,a red carpet is in a living room,coach,carpet,0.4,a red ! is in a living room,0.021806657314300537,0.671875
A red fire truck driving down a  street.,A red pickup truck driving down a  street.,fire,pickup,0.3,a red ! truck driving down a street.,-0.004915952682495117,1.0
A red flag flying through a blue sky.,A red plane flying through a blue sky.,flag,plane,0.8,a red ! flying through a blue sky.,-0.0721280574798584,1.0
