input_text,target_text,input_word,target_word,asr,baseline_sen,delta_2,bsr
A red flag is floating near some houses.,A red boat is floating near some houses.,flag,boat,0.9,a red ! is floating near some houses.,-0.019603252410888672,1.0
A red icing doughnut with sprinkles on top.,A red velvet doughnut with sprinkles on top.,icing,velvet,0.0,a red ! doughnut with sprinkles on top.,0.006677806377410889,0.953125
A red pickup truck driving down a  street.,A red fire truck driving down a  street.,pickup,fire,0.2,a red ! truck driving down a street.,0.004915952682495117,1.0
A red plane flying through a blue sky.,A red flag flying through a blue sky.,plane,flag,0.0,a red ! flying through a blue sky.,0.0721280574798584,0.984375
A red velvet doughnut with sprinkles on top.,A red icing doughnut with sprinkles on top.,velvet,icing,0.0,a red ! doughnut with sprinkles on top.,-0.006677806377410889,0.90625
A refrigerator freezer next to a  wall.,A small freezer next to a  wall.,refrigerator,small,0.0,a ! freezer next to a wall.,0.055372536182403564,0.71875
A restroom with a bathtub and a toilet.,A house with a bathtub and a toilet.,restroom,house,0.0,a ! with a bathtub and a toilet.,0.0075661540031433105,0.296875
a room showing a sink and some drawers,a photo showing a sink and some drawers,room,photo,0.0,a ! showing a sink and some drawers,0.051268696784973145,0.859375
A room with some chairs and a bookshelf.,A room with some chairs and a fireplace.,bookshelf.,fireplace.,0.1,a room with some chairs and a !,0.0642545223236084,1.0
A room with some chairs and a fireplace.,A room with some chairs and a bookshelf.,fireplace.,bookshelf.,0.0,a room with some chairs and a !,-0.0642545223236084,1.0
"A salad has cilantro, carrots, and other vegetables.","A sandwich has cilantro, carrots, and other vegetables.",salad,sandwich,1.0,"a ! has cilantro, carrots, and other vegetables.",-0.04246354103088379,0.984375
A salad with a sandwich and salad greens.,A plate with a sandwich and salad greens.,,plate,0.3,a ! with a sandwich and salad greens.,-0.05518472194671631,0.984375
a salad with chicken and some vegetables together,a plate with chicken and some vegetables together,salad,plate,0.5,a ! with chicken and some vegetables together,0.025371193885803223,1.0
"A sandwich has cilantro, carrots, and other vegetables.","A salad has cilantro, carrots, and other vegetables.",sandwich,salad,1.0,"a ! has cilantro, carrots, and other vegetables.",0.04246354103088379,0.984375
A sausage being made within the oven ,A pizza being made within the oven ,sausage,pizza,0.1,a ! being made within the oven,0.05574822425842285,0.90625
a sexy women that is on a mission,a sexy women that is on a skateboard,mission,skateboard,0.9,a sexy women that is on a !,-0.16215163469314575,0.90625
a sexy women that is on a skateboard,a sexy women that is on a mission,skateboard,mission,0.0,a sexy women that is on a !,0.16215163469314575,0.0
a shadow of a man on an umbrella ,a picture of a man on an umbrella ,shadow,picture,0.0,a ! of a man on a umbrella,-0.000693202018737793,0.0
a sheep in a field near a fence ,a dog in a field near a fence ,sheep,dog,0.1,a ! in a field near a fence,0.022155404090881348,0.96875
A sheep standing in a open grass field.,A man standing in a open grass field.,sheep,man,0.3,a ! standing in a open grass field.,0.09135580062866211,1.0
A single horse walking on a rocky trail.,A single woman walking on a rocky trail.,horse,woman,0.3,a single ! walking on a rocky trail.,0.05589860677719116,1.0
A single room with two separate twin beds.,A hotel room with two separate twin beds.,single,hotel,0.0,a ! room with two separate twin beds.,-0.03953683376312256,1.0
A single woman walking on a rocky trail.,A single horse walking on a rocky trail.,woman,horse,0.6,a single ! walking on a rocky trail.,-0.05589860677719116,1.0
A sink with cracked porcelain highlights this bathroom,A wall with cracked porcelain highlights this bathroom,sink,wall,0.0,a ! with cracked porcelain highlights this bathroom,0.06732916831970215,0.09375
A skateboarder is carrying groceries on his board,A man is carrying groceries on his board,skateboarder,man,0.0,a ! is carrying groceries on his board,0.1332937479019165,0.234375
A skateboarder preforming tricks on a half pipe. ,A magician preforming tricks on a half pipe. ,skateboarder,magician,0.0,a ! preforming tricks on a half pipe.,0.09246313571929932,0.0
A skateboarder rides along a diagonally slanted wall.,A train rides along a diagonally slanted wall.,skateboarder,train,0.0,a ! rides along a diagonally slanted wall.,0.21727418899536133,0.171875
A skier carving down a snowy mountain side,A man carving down a snowy mountain side,skier,man,0.0,a ! carving down a snowy mountain side,0.03575378656387329,0.875
A skier is going through bumpy snow hills.,A train is going through bumpy snow hills.,skier,train,0.1,a ! is going through bumpy snow hills.,0.03973102569580078,0.640625
A slice of chocolate cake with chocolate icing.,A piece of chocolate cake with chocolate icing.,slice,piece,0.0,a ! of chocolate cake with chocolate icing.,0.004792213439941406,1.0
A small airplane is flying in the sky.,A small plane is flying in the sky.,airplane,plane,0.0,a small ! is flying in the sky.,0.02141815423965454,1.0
A small bird is perched on a birdfeeder.,A small bird is perched on a tree.,birdfeeder.,tree.,0.0,a small bird is perched on a !,0.07010161876678467,0.609375
A small bird is perched on a tree.,A small bird is perched on a birdfeeder.,tree.,birdfeeder.,1.0,a small bird is perched on a !,-0.07010161876678467,0.828125
A small boy sitting on a luggage cart,A small boy sitting on a shopping cart,luggage,shopping,0.1,a small boy sitting on a ! cart,0.029993057250976562,0.9375
A small boy sitting on a shopping cart,A small boy sitting on a luggage cart,shopping,luggage,0.0,a small boy sitting on a ! cart,-0.029993057250976562,0.703125
a small child is holding up a bottle,a small child is holding up a toy,bottle,toy,0.4,a small child is holding up a !,0.0065879225730896,0.90625
a small child is holding up a toy,a small child is holding up a bottle,toy,bottle,0.2,a small child is holding up a !,-0.0065879225730896,0.84375
A small dining room with a king bed.,A small hotel room with a king bed.,dining,hotel,0.0,a small ! room with a king bed.,0.004586458206176758,0.0
a small dog is standing in a sink,a small fish is standing in a sink,dog,fish,0.0,a small ! is standing in a sink,0.01862013339996338,0.390625
A small egg sits on a white plate. ,A small sandwich sits on a white plate. ,egg,sandwich,0.9,a small ! sits on a white plate.,-0.021381258964538574,0.921875
a small fish is standing in a sink,a small dog is standing in a sink,fish,dog,0.3,a small ! is standing in a sink,-0.01862013339996338,0.859375
A small freezer next to a  wall.,A refrigerator freezer next to a  wall.,small,refrigerator,0.0,a ! freezer next to a wall.,-0.055372536182403564,0.65625
a small golden egg in a plastic bag,a small golden pastry in a plastic bag,egg,pastry,0.2,a small golden ! in a plastic bag,-0.036085546016693115,0.9375
a small golden pastry in a plastic bag,a small golden egg in a plastic bag,pastry,egg,0.0,a small golden ! in a plastic bag,0.036085546016693115,0.890625
A small hotel room with a king bed.,A small dining room with a king bed.,hotel,dining,0.0,a small ! room with a king bed.,-0.004586458206176758,0.0
A small plane is flying in the sky.,A small airplane is flying in the sky.,plane,airplane,0.0,a small ! is flying in the sky.,-0.02141815423965454,1.0
A small sandwich sits on a white plate. ,A small egg sits on a white plate. ,sandwich,egg,0.0,a small ! sits on a white plate.,0.021381258964538574,0.796875
A snowboarder catches air coming off a jump.,A jumper catches air coming off a jump.,snowboarder,jumper,0.0,a ! catches air coming off a jump.,0.2243422269821167,0.78125
a snowboarding moving down a hill laughing ,a man moving down a hill laughing ,snowboarding,man,0.0,a ! moving down a hill laughing,0.021705210208892822,0.453125
A soccer player jumps to return a ball.,A tennis player jumps to return a ball.,soccer,tennis,1.0,a ! player jumps to return a ball.,-0.0011335015296936035,0.96875
a sofa and a bed in a room,a chair and a bed in a room,sofa,chair,0.0,a ! and a bed in a room,0.03941679000854492,0.359375
A space filled with lots of counter space.,A kitchen filled with lots of counter space.,space,kitchen,0.0,a ! filled with lots of counter space.,-0.16173475980758667,0.96875
a spin brush tooth brush on the sink,a tooth brush tooth brush on the sink,spin,,0.0,a ! brush tooth brush on the sink,-0.002243518829345703,0.140625
a spooky looking hotel resort in the hills,a spooky looking ski resort in the hills,hotel,ski,0.0,a spooky looking ! resort in the hills,-0.050797462463378906,0.0
a spooky looking ski resort in the hills,a spooky looking hotel resort in the hills,ski,hotel,0.0,a spooky looking ! resort in the hills,0.050797462463378906,0.046875
a spoon next to a glass of beer ,a pizza next to a glass of beer ,spoon,pizza,1.0,a ! next to a glass of beer,-0.02109074592590332,1.0
A square pizza on a wooden cutting board.,A homemade pizza on a wooden cutting board.,square,homemade,0.1,a ! pizza on a wooden cutting board.,0.031500160694122314,1.0
A squirrel does a trick on a skateboard.,A guy does a trick on a skateboard.,squirrel,guy,0.2,a ! does a trick on a skateboard.,0.061246514320373535,0.984375
A squirrel holding a toothbrush in its mouth. ,A cat holding a toothbrush in its mouth. ,squirrel,cat,0.0,a ! holding a toothbrush in its mouth.,0.04083675146102905,0.453125
A squirrel jumping to catch a flying frisbee,A dog jumping to catch a flying frisbee,squirrel,dog,0.5,a ! jumping to catch a flying frisbee,0.031674087047576904,0.75
A squirrel riding it's skateboard on a ramp.,A teenager riding it's skateboard on a ramp.,squirrel,teenager,1.0,a ! riding it's skateboard on a ramp.,0.028867900371551514,0.859375
A squirrel that is playing in the snow.,A bird that is playing in the snow.,squirrel,bird,0.0,a ! that is playing in the snow.,0.04876899719238281,0.0
A squirrel that is standing behind a tree.,A giraffe that is standing behind a tree.,squirrel,giraffe,0.1,a ! that is standing behind a tree.,-0.017555058002471924,0.15625
A stack of clocks inside a shop window.,A display of clocks inside a shop window.,stack,display,0.0,a ! of clocks inside a shop window.,0.0013692378997802734,0.921875
A stained glassed candle shines over a clock.,A stained glassed window shines over a clock.,candle,window,0.7,a stained glassed ! shines over a clock.,0.058164894580841064,0.921875
A stained glassed window shines over a clock.,A stained glassed candle shines over a clock.,window,candle,0.0,a stained glassed ! shines over a clock.,-0.058164894580841064,0.125
A staircase that is sitting on some steps.,A cat that is sitting on some steps.,staircase,cat,0.5,a ! that is sitting on some steps.,0.06693416833877563,0.921875
A stop sign outside of a brick building.,A neon sign outside of a brick building.,stop,neon,0.2,a ! sign outside of a brick building.,0.004335463047027588,0.984375
a stop sign underneath some telephone wiring ,a warning sign underneath some telephone wiring ,stop,warning,0.0,a ! sign underneath some telephone wiring,0.0018761754035949707,0.46875
A store filled with bathroom equipment and accessories.,A store filled with bathroom supplies and accessories.,equipment,supplies,0.3,a store filled with bathroom ! and accessories.,0.020505785942077637,1.0
A store filled with bathroom supplies and accessories.,A store filled with bathroom equipment and accessories.,supplies,equipment,0.0,a store filled with bathroom ! and accessories.,-0.020505785942077637,0.984375
A stove standing next to a fridge freezer ,A man standing next to a fridge freezer ,stove,man,0.4,a ! standing next to a fridge freezer,0.036328792572021484,0.78125
A strange plant hanging off a banana tree.,A strange plant hanging off a Christmas tree.,banana,Christmas,0.0,a strange plant hanging off a ! tree.,0.024881958961486816,0.0
A strange plant hanging off a Christmas tree.,A strange plant hanging off a banana tree.,Christmas,banana,0.0,a strange plant hanging off a ! tree.,-0.024881958961486816,0.0
A street pole is loaded with different signs.,A totem pole is loaded with different signs.,street,totem,0.1,a ! pole is loaded with different signs.,-0.02781778573989868,0.09375
A street sign above an orange detour sign.,A yellow sign above an orange detour sign.,street,yellow,0.0,a ! sign above a orange detour sign.,0.0005946159362792969,0.03125
A street sign is underneath a concrete overpass. ,A warning sign is underneath a concrete overpass. ,street,warning,0.0,a ! sign is underneath a concrete overpass.,0.021464884281158447,0.734375
A stuffed animal is sitting outside an eatery.,A stuffed bear is sitting outside an eatery.,animal,bear,0.0,a stuffed ! is sitting outside a eatery.,0.00010895729064941406,0.84375
A stuffed bear is sitting outside an eatery.,A stuffed animal is sitting outside an eatery.,bear,animal,0.0,a stuffed ! is sitting outside a eatery.,-0.00010895729064941406,0.765625
a surfer riding a wave under a pier,a woman riding a wave under a pier,surfer,woman,0.0,a ! riding a wave under a pier,0.02714771032333374,0.703125
A table and some chairs in a room.,A television and some chairs in a room.,table,television,0.0,a ! and some chairs in a room.,-0.05707508325576782,0.96875
a table with a vase with many flowers,a tree with a vase with many flowers,table,tree,0.0,a ! with a vase with many flowers,-0.011102795600891113,0.21875
A tall brick church adorned with a clock.,A tall brick church spire with a clock.,adorned,spire,0.0,a tall brick church ! with a clock.,-0.05294764041900635,0.96875
A tall brick church spire with a clock.,A tall brick church adorned with a clock.,spire,adorned,0.0,a tall brick church ! with a clock.,0.05294764041900635,0.96875
A tall building with a large white dome.,A tall building with a large white statue.,dome.,statue.,0.0,a tall building with a large white !,0.00929570198059082,0.453125
A tall building with a large white statue.,A tall building with a large white dome.,statue.,dome.,0.1,a tall building with a large white !,-0.00929570198059082,1.0
a tall tower in front of some buildings ,a clock tower in front of some buildings ,tall,clock,0.6,a ! tower in front of some buildings,-0.11580431461334229,1.0
A teenager is wearing glasses and a tie.,A woman is wearing glasses and a tie.,teenager,woman,0.1,a ! is wearing glasses and a tie.,0.006536245346069336,0.9375
A teenager riding it's skateboard on a ramp.,A squirrel riding it's skateboard on a ramp.,teenager,squirrel,0.0,a ! riding it's skateboard on a ramp.,-0.028867900371551514,0.296875
A television and some chairs in a room.,A table and some chairs in a room.,television,table,0.7,a ! and some chairs in a room.,0.05707508325576782,1.0
A tennis player jumps and hits a ball.,A baseball player jumps and hits a ball.,tennis,baseball,0.6,a ! player jumps and hits a ball.,0.013830840587615967,0.328125
A tennis player jumps to return a ball.,A soccer player jumps to return a ball.,tennis,soccer,0.9,a ! player jumps to return a ball.,0.0011335015296936035,0.484375
A toaster oven filled with lots of food.,A hot oven filled with lots of food.,toaster,hot,0.1,a ! oven filled with lots of food.,0.1440255045890808,0.671875
A toddler is sitting inside a large bathtub.,A cat is sitting inside a large bathtub.,toddler,cat,0.6,a ! is sitting inside a large bathtub.,0.03061884641647339,0.734375
a tooth brush tooth brush on the sink,a spin brush tooth brush on the sink,,spin,0.0,a ! brush tooth brush on the sink,0.002243518829345703,0.0
A totem pole is loaded with different signs.,A street pole is loaded with different signs.,totem,street,0.0,a ! pole is loaded with different signs.,0.02781778573989868,1.0
A traffic light by a Lutzdale sign. ,A traffic light by a Lutz road sign. ,Lutzdale,Lutz road,0.0,a traffic light by a ! sign. !,-0.00891721248626709,0.125
A traffic light by a Lutz road sign. ,A traffic light by a Lutzdale sign. ,Lutz road,Lutzdale,0.0,a traffic light by a ! sign. !,0.00891721248626709,0.296875
A traffic light is showing a green arrow.,A traffic light is showing a green light.,arrow.,light.,0.0,a traffic light is showing a green !,0.04381674528121948,0.71875
A traffic light is showing a green light.,A traffic light is showing a green arrow.,light.,arrow.,0.0,a traffic light is showing a green !,-0.04381674528121948,0.578125
A train engine carrying carts down a track.,A diesel engine carrying carts down a track.,train,diesel,0.0,a ! engine carrying carts down a track.,-0.014248490333557129,0.75
A train is going through bumpy snow hills.,A skier is going through bumpy snow hills.,train,skier,0.6,a ! is going through bumpy snow hills.,-0.03973102569580078,0.6875
A train rides along a diagonally slanted wall.,A skateboarder rides along a diagonally slanted wall.,train,skateboarder,0.5,a ! rides along a diagonally slanted wall.,-0.21727418899536133,0.765625
A train that is going by some grass.,A horse that is going by some grass.,train,horse,0.6,a ! that is going by some grass.,0.010481417179107666,0.875
A tray of black and white sprinkled doughnuts ,A bowl of black and white sprinkled doughnuts ,tray,bowl,0.0,a ! of black and white sprinkled doughnuts,-0.00649493932723999,0.796875
a tree in a field near many trees ,a horse in a field near many trees ,tree,horse,0.9,a ! in a field near many trees,-0.060201942920684814,1.0
a tree in a field of tall grass,a horse in a field of tall grass,tree,horse,0.5,a ! in a field of tall grass,-0.01722133159637451,1.0
A tree that is standing in the dirt.,A elephant that is standing in the dirt.,tree,elephant,0.5,a ! that is standing in the dirt.,-0.06722235679626465,1.0
a tree with a vase with many flowers,a table with a vase with many flowers,tree,table,1.0,a ! with a vase with many flowers,0.011102795600891113,1.0
A tree with plants sitting in the window,A kitchen with plants sitting in the window,tree,kitchen,0.9,a ! with plants sitting in the window,-0.02499973773956299,1.0
a tree with some flowers near a window,a vase with some flowers near a window,tree,vase,0.7,a ! with some flowers near a window,0.004670977592468262,1.0
A truck is carrying some huge tree trunks.,A man is carrying some huge tree trunks.,truck,man,0.0,a ! is carrying some huge tree trunks.,0.028591156005859375,0.75
a truck that transports cars on the back,a van that transports cars on the back,truck,van,0.0,a ! that transports cars on the back,0.056078553199768066,0.140625
A tv remote control sits on a shelf.,A tv remote control sits on a table.,shelf.,table.,0.0,a tv remote control sits on a !,-0.004382193088531494,0.921875
A tv remote control sits on a table.,A tv remote control sits on a shelf.,table.,shelf.,0.1,a tv remote control sits on a !,0.004382193088531494,0.671875
a underground train station in the bronx are ,a underground train station in the Netherlands are ,bronx,Netherlands,0.0,a underground train station in the ! are,-0.023140251636505127,0.0
a underground train station in the Netherlands are ,a underground train station in the bronx are ,Netherlands,bronx,0.0,a underground train station in the ! are,0.023140251636505127,0.0
a van that transports cars on the back,a truck that transports cars on the back,van,truck,0.0,a ! that transports cars on the back,-0.056078553199768066,0.171875
a vase with some flowers near a window,a tree with some flowers near a window,vase,tree,0.4,a ! with some flowers near a window,-0.004670977592468262,0.6875
A vending voucher machine on a snow-covered sidewalk.,A parking voucher machine on a snow-covered sidewalk.,vending,parking,0.0,a ! voucher machine on a snow-covered sidewalk.,-0.022388935089111328,1.0
A very large and very posh living room.,A very large and very posh living space.,room.,space.,0.0,a very large and very posh living !,0.009449958801269531,1.0
A very large and very posh living space.,A very large and very posh living room.,space.,room.,0.0,a very large and very posh living !,-0.009449958801269531,1.0
A veterinarian attending to an injured brown horse.,A performer attending to an injured brown horse.,veterinarian,performer,0.0,a ! attending to a injured brown horse.,0.06215488910675049,0.0
A waiting area in an airport terminal ,A waiting queue in an airport terminal ,area,queue,0.0,a waiting ! in a airport terminal,0.023886442184448242,1.0
A waiting queue in an airport terminal ,A waiting area in an airport terminal ,queue,area,0.3,a waiting ! in a airport terminal,-0.023886442184448242,0.984375
A wall with cracked porcelain highlights this bathroom,A sink with cracked porcelain highlights this bathroom,wall,sink,0.0,a ! with cracked porcelain highlights this bathroom,-0.06732916831970215,0.078125
A warning sign is underneath a concrete overpass. ,A street sign is underneath a concrete overpass. ,warning,street,0.0,a ! sign is underneath a concrete overpass.,-0.021464884281158447,0.46875
a warning sign underneath some telephone wiring ,a stop sign underneath some telephone wiring ,warning,stop,0.0,a ! sign underneath some telephone wiring,-0.0018761754035949707,0.3125
a well arranged room as an exhibition room,a well arranged room as an meeting room,exhibition,meeting,0.4,a well arranged room as a ! room,-0.05537736415863037,1.0
a well arranged room as an meeting room,a well arranged room as an exhibition room,meeting,exhibition,0.8,a well arranged room as a ! room,0.05537736415863037,0.359375
A while horse bending down eating grass .,A grazing horse bending down eating grass.,while grass .,grazing grass.,0.0,a ! horse bending down eating ! !,-0.08107131719589233,0.6875
a white bird is standing on a beach,a white bird is standing on a ledge,beach,ledge,0.8,a white bird is standing on a !,0.0028384923934936523,0.9375
a white bird is standing on a ledge,a white bird is standing on a beach,ledge,beach,0.2,a white bird is standing on a !,-0.0028384923934936523,0.953125
A white bus driving past a tall building.,A white sedan driving past a tall building.,bus,sedan,0.0,a white ! driving past a tall building.,0.01733499765396118,0.859375
A white bus is driving down the street,A white SUV is driving down the street,bus,SUV,0.9,a white ! is driving down the street,-0.013334214687347412,0.953125
A white ceramic sink next to a toilet.,A white kitchen sink next to a toilet.,ceramic,kitchen,0.0,a white ! sink next to a toilet.,-0.061553359031677246,0.015625
A white desk and mirror in a room.,A white sink and mirror in a room.,desk,sink,0.7,a white ! and mirror in a room.,-0.0825040340423584,0.75
A white elephant in a very small kitchen.,A white refrigerator in a very small kitchen.,elephant,refrigerator,0.0,a white ! in a very small kitchen.,-0.09682011604309082,0.03125
A white elephant sitting next to a toilet.,A white sink sitting next to a toilet.,elephant,sink,0.0,a white ! sitting next to a toilet.,-0.010959386825561523,0.390625
A white kitchen sink next to a toilet.,A white ceramic sink next to a toilet.,kitchen,ceramic,0.2,a white ! sink next to a toilet.,0.061553359031677246,0.359375
A white refrigerator in a very small kitchen.,A white elephant in a very small kitchen.,refrigerator,elephant,0.0,a white ! in a very small kitchen.,0.09682011604309082,0.0
A white sedan driving past a tall building.,A white bus driving past a tall building.,sedan,bus,0.7,a white ! driving past a tall building.,-0.01733499765396118,0.890625
A white sheep with two black baby sheeps.,A mother sheep with two black baby sheeps.,white,mother,0.1,a ! sheep with two black baby sheeps.,-0.016997933387756348,0.5625
A white sink and mirror in a room.,A white desk and mirror in a room.,sink,desk,0.0,a white ! and mirror in a room.,0.0825040340423584,0.96875
A white sink and tub in a bathroom.,A white towel and tub in a bathroom.,sink,towel,0.0,a white ! and tub in a bathroom.,0.021786510944366455,0.953125
A white sink sitting next to a toilet.,A white elephant sitting next to a toilet.,sink,elephant,0.0,a white ! sitting next to a toilet.,0.010959386825561523,0.078125
A white SUV is driving down the street,A white bus is driving down the street,SUV,bus,0.6,a white ! is driving down the street,0.013334214687347412,1.0
A white SUV that has its seat up.,A white toilet that has its seat up.,SUV,toilet,0.9,a white ! that has its seat up.,-0.009846627712249756,0.953125
A white toilet that has its seat up.,A white SUV that has its seat up.,toilet,SUV,0.0,a white ! that has its seat up.,0.009846627712249756,0.03125
A white towel and tub in a bathroom.,A white sink and tub in a bathroom.,towel,sink,0.0,a white ! and tub in a bathroom.,-0.021786510944366455,0.515625
A woman adjusts clock while several people watch.,A woman adjusts sunglasses while several people watch.,clock,sunglasses,0.6,a woman adjusts ! while several people watch.,-0.04757678508758545,0.984375
A woman adjusts sunglasses while several people watch.,A woman adjusts clock while several people watch.,sunglasses,clock,0.2,a woman adjusts ! while several people watch.,0.04757678508758545,0.765625
A woman bathing her dog in the shower,A woman bathing her dog in the sink,shower,sink,0.0,a woman bathing her dog in the !,0.008340239524841309,0.765625
A woman bathing her dog in the sink,A woman bathing her dog in the shower,sink,shower,0.4,a woman bathing her dog in the !,-0.008340239524841309,0.75
A woman carrying skis up a snowy hill.,A woman carrying skis up a snowy slope.,hill.,slope.,0.0,a woman carrying skis up a snowy !,-0.00685572624206543,0.84375
A woman carrying skis up a snowy slope.,A woman carrying skis up a snowy hill.,slope.,hill.,0.0,a woman carrying skis up a snowy !,0.00685572624206543,0.625
